paper_id,title,abstract,authors,authorids,keywords,primary_area,venue,year,pdf_url,forum_url
KZEqbwJfTl,Distribution-Specific Agnostic Conditional Classification With Halfspaces,"We study ""selective"" or ""conditional"" classification problems under an agnostic setting. Classification tasks commonly focus on modeling the relationship between features and categories that captures the vast majority of data. In contrast to common machine learning frameworks, conditional classification intends to model such relationships only on a subset of the data defined by some selection rule. Most work on conditional classification either solves the problem in a realizable setting or does not guarantee the error is bounded compared to an optimal solution. In this work, we consider selective/conditional classification by sparse linear classifiers for subsets defined by halfspaces, and give both positive as well as negative results for Gaussian feature distributions. On the positive side, we present the first PAC-learning algorithm for homogeneous halfspace selectors with error guarantee $\tilde{O}(\sqrt{\mathrm{opt}})$, where $\mathrm{opt}$ is the smallest conditional classification error over the given class of classifiers and homogeneous halfspaces. On the negative side, we find that, under cryptographic assumptions, approximating the conditional classification loss within a small additive error is computationally hard even under Gaussian distribution. We prove that approximating conditional classification is at least as hard as approximating agnostic classification in both additive and multiplicative form.","Jizhou Huang, Brendan Juba","~Jizhou_Huang2, ~Brendan_Juba1","Agnostic linear classification, PAC-learning, Intractability",learning theory,ICLR 2025 Poster,2025,https://openreview.net/pdf?id=KZEqbwJfTl,https://openreview.net/forum?id=KZEqbwJfTl
BfQNrKJMXq,MobileAgentBench: An Efficient and User-Friendly Benchmark for Mobile LLM Agents,"Large Language Model (LLM)-based mobile agents are increasingly popular due to their capability to interact directly with mobile phone Graphic User Interfaces (GUIs) and their potential to autonomously manage daily tasks. Despite their promising prospects in both academic and industrial sectors, little research has focused on benchmarking the performance of existing mobile agents, due to the inexhaustible states of apps and the vague definition of feasible action sequences. To address this challenge, we propose an efficient and user-friendly benchmark, MobileAgentBench, designed to alleviate the burden of extensive manual testing. We initially define 100 tasks across 10 open-source apps, categorized by multiple levels of difficulty. Subsequently, we evaluate several existing mobile agents, including AppAgent and MobileAgent, to thoroughly and systematically compare their performance. All materials will be accessible on our project webpage, contributing to the advancement of both academic and industrial fields.","Luyuan Wang, Yongyu Deng, Yiwei Zha, Guodong Mao, Qinmin Wang, Tianchen Min, Wei Chen, Shoufa Chen","~Luyuan_Wang2, ~Yongyu_Deng1, ~Yiwei_Zha1, ~Guodong_Mao1, ~Qinmin_Wang2, ~Tianchen_Min1, ~Wei_Chen63, ~Shoufa_Chen1","LLM, Agent, Benchmark",datasets and benchmarks,ICLR 2025 Conference Withdrawn Submission,2025,https://openreview.net/pdf?id=BfQNrKJMXq,https://openreview.net/forum?id=BfQNrKJMXq
jNmsuEE4Gf,Feynman: Knowledge-Infused Diagramming Agent for Scaling Visual Reasoning Data,"Visual reasoning is an essential ability of state-of-the-art multi-modal AI systems. Improving these systems requires high-quality vision-language data at scale. Despite the abundance of internet image and text data, knowledge-rich and well-aligned image-text pairs are rare. In this paper, we present a scalable data generation pipeline built with our diagramming agent, **Feynman**. To create diagrams, Feynman first enumerates domain-specific knowledge components (""ideas"") and performs code planning based on the ideas. Given the plan, Feynman translates ideas into simple declarative programs and iterates to receives feedback and visually refine diagrams. Finally, the declarative programs are rendered by the Penrose diagramming system. The optimization-based rendering of Penrose preserves the visual semantics while injecting fresh randomness into the layout, thereby producing diagrams with visual consistency and diversity. As a result, Feynman can author diagrams along with grounded captions with very little cost and time. Using Feynman, we synthesized a dataset with more than 100$k$ well-aligned diagram-caption pairs. We also curate a visual-language benchmark, **Diagramma**, from freshly generated data.","Zixin Wen, Yifu Cai, Kyle Lee, Sam Estep, Joshua Sunshine, Aarti Singh, Yuejie Chi, Wode Ni","~Zixin_Wen1, ~Yifu_Cai1, ~Kyle_Lee2, ~Sam_Estep1, ~Joshua_Sunshine1, ~Aarti_Singh1, ~Yuejie_Chi1, ~Wode_Ni1","Vision-Language Dataset, Synthetic Data, Visual Reasoning Benchmark",datasets and benchmarks,Submitted to ICLR 2025,2025,https://openreview.net/pdf?id=jNmsuEE4Gf,https://openreview.net/forum?id=jNmsuEE4Gf
iTm4H6N4aG,ClassDiffusion: More Aligned Personalization Tuning with Explicit Class Guidance,"Recent text-to-image customization works have proven successful in generating images of given concepts by fine-tuning diffusion models on a few examples. However, tuning-based methods inherently tend to overfit the concepts, resulting in failure to create the concept under multiple conditions (*e.g.*, headphone is missing when generating ""a <sks>`dog wearing a headphone""). Interestingly, we notice that the base model before fine-tuning exhibits the capability to compose the base concept with other elements (*e.g.*, ""a dog wearing a headphone""), implying that the compositional ability only disappears after personalization tuning. We observe a semantic shift in the customized concept after fine-tuning, indicating that the personalized concept is not aligned with the original concept, and further show through theoretical analyses that this semantic shift leads to increased difficulty in sampling the joint conditional probability distribution, resulting in the loss of the compositional ability. Inspired by this finding, we present **ClassDiffusion**, a technique that leverages a **semantic preservation loss** to explicitly regulate the concept space when learning a new concept. Although simple, this approach effectively prevents semantic drift during the fine-tuning process of the target concepts. Extensive qualitative and quantitative experiments demonstrate that the use of semantic preservation loss effectively improves the compositional abilities of fine-tuning models. Lastly, we also extend our ClassDiffusion to personalized video generation, demonstrating its flexibility.","Jiannan Huang, Jun Hao Liew, Hanshu Yan, Yuyang Yin, Yao Zhao, Humphrey Shi, Yunchao Wei","~Jiannan_Huang2, ~Jun_Hao_Liew1, ~Hanshu_Yan1, ~Yuyang_Yin1, ~Yao_Zhao1, ~Humphrey_Shi1, ~Yunchao_Wei1","Diffusion, Subject-Driven Personalization",generative models,ICLR 2025 Poster,2025,https://openreview.net/pdf?id=iTm4H6N4aG,https://openreview.net/forum?id=iTm4H6N4aG
k03mB41vyM,Identifiable Exchangeable Mechanisms for Causal Structure and Representation Learning,"Identifying latent representations or causal structures is important for good generalization and downstream task performance. However, both fields developed rather independently.
We observe that several structure and representation identifiability methods, particularly those that require multiple environments, rely on 
exchangeable non--i.i.d. (independent and identically distributed) data.
To formalize this connection, 
we propose the Identifiable Exchangeable Mechanisms (IEM) framework to unify key representation and causal structure learning methods. IEM provides a unified probabilistic graphical model encompassing causal discovery, Independent Component Analysis, and Causal Representation Learning.
With the help of the IEM model, we generalize the Causal de Finetti theorem of Guo et al., 2022 by relaxing the necessary conditions for causal structure identification in exchangeable data.
We term these conditions cause and mechanism variability, and show how they imply a duality condition in identifiable representation learning, leading to new identifiability results.","Patrik Reizinger, Siyuan Guo, Ferenc Huszár, Bernhard Schölkopf, Wieland Brendel","~Patrik_Reizinger1, ~Siyuan_Guo1, ~Ferenc_Huszár1, ~Bernhard_Schölkopf1, ~Wieland_Brendel1","causality, ICA, identifiability, causal representation learning",causal reasoning,ICLR 2025 Spotlight,2025,https://openreview.net/pdf?id=k03mB41vyM,https://openreview.net/forum?id=k03mB41vyM
oOSeOEXrFA,REPOFILTER: Adaptive Retrieval Context Trimming for Repository-Level Code Completion,"Retrieval-Augmented Generation (RAG) has recently emerged as a promising approach for repository-level code completion by integrating cross-file knowledge with in-file preceding code to provide comprehensive contexts for generation. To better understand the contribution of the retrieved cross-file contexts, we introduce a likelihood-based metric to evaluate the impact of each retrieved code chunk on the completion. Our analysis reveals that, despite retrieving numerous chunks, only a small subset positively contributes to the target completion, while some chunks even degrade performance. To address this issue, we leverage this metric to construct a repository-level dataset where each retrieved chunk is labeled as positive, neutral, or negative based on its relevance to the target completion. We then propose an adaptive retrieval context trimming framework, REPOFILTER, trained on this dataset to mitigate the harmful effects of negative retrieved contexts in RAG-based code completion. Extensive evaluation on the RepoEval and CrossCodeLongEval benchmarks demonstrates that REPOFILTER consistently improves completion accuracy compared to approaches without filtering operations across various tasks. Additionally, REPOFILTER significantly reduces the length of the input prompt, enhancing computational efficiency while exhibiting strong generalizability across different models. These results underscore the potential of REPOFILTER to enhance the accuracy, efficiency, and attributability of RAG-based repository-level code completion.","Yanzhou Li, Shangqing Liu, Kangjie Chen, Tianwei Zhang, Yang Liu","~Yanzhou_Li1, ~Shangqing_Liu1, ~Kangjie_Chen1, ~Tianwei_Zhang1, ~Yang_Liu36","Code completion, RAG, LLMs","applications to computer vision, audio, language, and other modalities",Submitted to ICLR 2025,2025,https://openreview.net/pdf?id=oOSeOEXrFA,https://openreview.net/forum?id=oOSeOEXrFA
xE5ZaZGqBW,Hypercone Assisted Contour Generation for Out-of-Distribution Detection,"Recent advances in the field of out-of-distribution (OOD) detection have placed great emphasis on learning better representations suited to this task. While there have been distance-based approaches, distributional awareness has seldom been exploited for better performance. We present HACk-OOD, a novel OOD detection method that makes no distributional assumption about the data, but automatically adapts to its distribution. Specifically, HACk-OOD constructs a set of hypercones by maximizing the angular distance to neighbors in a given data-point's vicinity, to approximate the contour within which in-distribution (ID) data-points lie. Experimental results show state-of-the-art FPR@95 and AUROC performance on Near-OOD detection and on Far-OOD detection on the challenging CIFAR-100 benchmark without explicitly training for OOD performance.","Annita Vapsi, Andrés Muñoz Garza, Nancy Thomas, Keshav Ramani, Daniel Borrajo","~Annita_Vapsi1, ~Andrés_Muñoz_Garza1, ~Nancy_Thomas1, ~Keshav_Ramani1, ~Daniel_Borrajo1","OOD detection, Out-of-distribution detection, Computer Vision, Deep Learning, Representation Learning","other topics in machine learning (i.e., none of the above)",Submitted to ICLR 2025,2025,https://openreview.net/pdf?id=xE5ZaZGqBW,https://openreview.net/forum?id=xE5ZaZGqBW
AuAj4vRPkv,Transformers Provably Learn Two-Mixture of Linear Classification via Gradient Flow,"Understanding how transformers learn and utilize hidden connections between tokens is crucial to understand the behavior of large language models.
To understand this mechanism, we consider the task of two-mixture of linear classification which possesses a hidden correspondence structure among tokens, and study the training dynamics of a symmetric two-headed transformer with ReLU neurons.
Motivated by the stage-wise learning phenomenon in our experiments, we design and theoretically analyze a three-stage training algorithm, which can effectively characterize the actual gradient descent dynamics when we simultaneously train the neuron weights and the softmax attention.
The first stage is a neuron learning stage, where the neurons align with the underlying signals. 
The second stage is a attention feature learning stage, where we analyze the feature learning process of how the attention learns to utilize the relationship between the tokens to solve certain hard samples.
In the meantime, the attention features evolve from a nearly non-separable state (at the initialization) to a well-separated state.
The third stage is a convergence stage, where the population loss is driven towards zero.
The key technique in our analysis of softmax attention is to identify a critical sub-system inside a large dynamical system and bound the growth of the non-linear sub-system by a linear system. 
Finally, we discuss the setting with more than two mixtures. 
We empirically show the difficulty of generalizing our analysis of the gradient flow dynamics to the case even when the number of mixtures equals three, although the transformer can still successfully learn such distribution. 
On the other hand, we show by construction that there exists a transformer that can solve mixture of linear classification given any arbitrary number of mixtures.","Hongru Yang, Zhangyang Wang, Jason D. Lee, Yingbin Liang","~Hongru_Yang1, ~Zhangyang_Wang1, ~Jason_D._Lee1, ~Yingbin_Liang1","transformer, training dynamics, gradient flow, mixture of linear classification",learning theory,ICLR 2025 Poster,2025,https://openreview.net/pdf?id=AuAj4vRPkv,https://openreview.net/forum?id=AuAj4vRPkv
jDpdQPMosW,"Fundamental Limits of Prompt Tuning Transformers: Universality, Capacity and Efficiency","We investigate the statistical and computational limits of prompt tuning for transformer-based foundation models.  Our key contributions are that prompt tuning on *single-head* transformers with only a *single* self-attention layer:  (i) is universal, and  (ii) supports efficient (even almost-linear time) algorithms under the Strong Exponential Time Hypothesis (SETH).  Statistically,  we prove that prompt tuning on such the simplest possible transformers are universal approximators for sequence-to-sequence Lipschitz functions.  In addition, we provide an exponential-in-$dL$ and -in-$(1/\epsilon)$ lower bound on the required soft-prompt tokens for prompt tuning to memorize any dataset with 1-layer, 1-head transformers.  Computationally, we identify a phase transition in the efficiency of prompt tuning, determined by the norm of the *soft-prompt-induced* keys and queries, and provide an upper bound criterion.  Beyond this criterion, no sub-quadratic (efficient) algorithm for prompt tuning exists under SETH.  Within this criterion,  we showcase our theory by proving the existence of almost-linear time prompt tuning inference algorithms.  These fundamental limits provide important necessary conditions for designing expressive and efficient prompt tuning methods for practitioners.","Jerry Yao-Chieh Hu, Wei-Po Wang, Ammar Gilani, Chenyang Li, Zhao Song, Han Liu","~Jerry_Yao-Chieh_Hu1, ~Wei-Po_Wang1, ~Ammar_Gilani1, ~Chenyang_Li6, ~Zhao_Song3, ~Han_Liu4","Foundation Model, Prompt Tuning, Transformer, Universal Approximation, Memory Capacity, Computational Efficiency, Fine-Grained Complexity","foundation or frontier models, including LLMs",ICLR 2025 Poster,2025,https://openreview.net/pdf?id=jDpdQPMosW,https://openreview.net/forum?id=jDpdQPMosW
o9ewXD1JuB,OLAPH: Improving Factuality in Biomedical Long-form Question Answering,"In the medical domain, numerous scenarios necessitate the long-form generation ability of large language models (LLMs). Specifically, when addressing patients' questions, it is essential that the model's response conveys factual claims, highlighting the need for an automated method to evaluate those claims. Thus, we introduce MedLFQA, a benchmark dataset reconstructed using long-form question-answering datasets related to the biomedical domain. We use MedLFQA to facilitate a cost-effective automatic evaluations of factuality. We also propose OLAPH, a simple and novel framework that utilizes cost-effective and multifaceted automatic evaluation to construct a synthetic preference set and answers questions in our preferred manner. Our framework leads us to train LLMs step-by-step to reduce hallucinations and include crucial medical claims. We highlight that, even on evaluation metrics not used during training, LLMs trained with our OLAPH framework demonstrate significant performance improvement in factuality. Our findings reveal that a 7B LLM trained with our OLAPH framework can provide long answers comparable to the medical experts' answers in terms of factuality. We believe that our work could shed light on gauging the long-text generation ability of LLMs in the medical domain. Our code and datasets are available.","Minbyul Jeong, Hyeon Hwang, Chanwoong Yoon, Taewhoo Lee, Jaewoo Kang","~Minbyul_Jeong1, ~Hyeon_Hwang1, ~Chanwoong_Yoon1, ~Taewhoo_Lee1, ~Jaewoo_Kang1","medical question answering, automatic evaluation, factuality, hallucination","applications to physical sciences (physics, chemistry, biology, etc.)",Submitted to ICLR 2025,2025,https://openreview.net/pdf?id=o9ewXD1JuB,https://openreview.net/forum?id=o9ewXD1JuB
0sJ8TqOLGS,LLM Spark: Critical Thinking Evaluation of Large Language Models,"Large language models (LLMs) excel in complex tasks but often struggle with
inconsistencies in problem framing, a critical skill for real-world scenarios. This
paper introduces SPARK, a novel evaluation framework grounded in the Hierar-
chical Three-Space Theory, to assess LLMs’ ability to identify missing informa-
tion and challenge flawed problem setups. We propose a general framework to
create benchmarks by introducing inconsistencies and misleading cues in diverse
question-answering datasets, covering mathematics, science, and reading compre-
hension. To assist with robust measuring of critical thinking, we employ two key
metrics: problem-solving capability rate and challenge rate. Our experiments with
state-of-the-art LLMs reveal their limitations in critical thinking, particularly in
recognizing inconsistencies. We also explore mitigation strategies, such as modi-
fied prompting and targeted fine-tuning. Furthermore, we conduct comprehensive
experiments to investigate how model and problem properties influence critical
thinking capabilities in LLMs.","Runing Yang, Adam Nguyen, Hoang Anh Just, Ruoxi Jia, Ming Jin","~Runing_Yang1, ~Adam_Nguyen1, ~Hoang_Anh_Just1, ~Ruoxi_Jia1, ~Ming_Jin2","critical thinking, llm, problem-solving, benchmarks",datasets and benchmarks,Submitted to ICLR 2025,2025,https://openreview.net/pdf?id=0sJ8TqOLGS,https://openreview.net/forum?id=0sJ8TqOLGS
SMlVEeoSyI,StretchySnake: Flexible VideoMamba for Short and Long-Form Action Recognition,"State space models (SSMs) have very recently been introduced as an alternative deep architecture to transformers, exhibiting competitive or superior performance across various language and vision tasks. However, both SSMs and transformers share certain limitations in the vision domain, namely spatio-temporal inflexibility. Traditionally, deep video models are trained on a fixed resolution and number of frames, often arbitrarily chosen as a trade-off between performance and computational cost. Changing the resolution and/or number of frames a model can ingest usually requires retraining the model, while avoiding re-training by variably changing the weights of a trained model leads to significantly reduced test accuracy. In this paper, we introduce a spatio-temporal flexible training method that encourages a single set of learned weights to adapt well to any input resolution or video length. We achieve this by simply randomly changing the spatial and temporal resolutions of a video during training, and dynamically interpolating the model's weights accordingly. This single change in training not only allows for one model to be applied to both short and long video understanding tasks alike, but also allows for user-specific tailoring of computational cost. We propose and evaluate $5$ different spatio-temporal flexible training methods to find the optimal type for training a video SSM. We then evaluate our best flexibly-trained SSM, which we call StretchySnake, across a variety of short- and long-form action recognition evaluation protocols, such as video retrieval, fine-tuning, and linear probing, and massively outperform the same vanilla video SSM trained in a standard fashion by up to $28$% in some cases. Therefore, our training method can be used as a simple drop-in training technique for any SSM-based video models to strongly improve performance and instill spatio-temporal and compute flexibility.","Nyle Siddiqui, Rohit Gupta, Swetha Sirnam, Mubarak Shah","~Nyle_Siddiqui1, ~Rohit_Gupta3, ~Swetha_Sirnam1, ~Mubarak_Shah3","Representation Learning, Video Understanding, State Space Models","unsupervised, self-supervised, semi-supervised, and supervised representation learning",Submitted to ICLR 2025,2025,https://openreview.net/pdf?id=SMlVEeoSyI,https://openreview.net/forum?id=SMlVEeoSyI
ywgwArtbDq,Seeing Through the Mask: Rethinking Adversarial Examples for CAPTCHAs,"Modern CAPTCHAs often rely on vision tasks that are supposedly hard for computers but easy for humans. Although image recognition models pose a significant threat to such CAPTCHAs, they can be fooled by hiding ``random'' noise in images. However, these methods are model-specific and thus can not aid CAPTCHAs in fooling all models. 
    We show in this work that by allowing for more significant changes to the images while preserving the semantic information and keeping it solvable by humans, we can fool many state-of-the-art models. Specifically, we demonstrate that by adding masks of various intensities the Top 1 Accuracy (Acc@1) drops by more than 50%-points for all models, and supposedly robust models such as vision transformers see an Acc@1 drop of 80%-points. 
    These masks can therefore effectively fool modern image classifiers, thus showing that machines have not caught up with humans -- yet.","Andreas Plesner, Yahya Jabary, Turlan Kuzhagaliyev, Roger Wattenhofer","~Andreas_Plesner1, ~Yahya_Jabary1, ~Turlan_Kuzhagaliyev1, ~Roger_Wattenhofer1","CAPTCHAs, Adversarial examples, Vision models, Robust models","other topics in machine learning (i.e., none of the above)",ICLR 2025 Conference Withdrawn Submission,2025,https://openreview.net/pdf?id=ywgwArtbDq,https://openreview.net/forum?id=ywgwArtbDq
6AUzsrsNUx,MetaTool: Facilitating Large Language Models to Master Tools with Meta-task Augmentation,"Utilizing tools with Large Language Models (LLMs) is essential for grounding AI agents in real-world applications. The prevailing approach involves few-shot prompting with demonstrations or fine-tuning with expert annotations. However, mere in-context demonstrations may fail to cover sufficient knowledge for complex tools and tasks. Training on solution paths is also hindered by the high cost of expert annotations and generalizing to new tools. A core challenge of generalizable tool use lies in understanding the ""meta'', or fundamental natures of tools that are transferable across tasks, such as causality and constraints. In this paper, we present MetaTool, a novel tool learning methodology designed to generalize across any reusable toolset. Our approach incorporates a self-supervised augmentation technique derived from a series of meta-tasks. This involves predicting masked elements in the tool execution process. The self-supervised procedure enables scalable generation of high-quality QA data, which is handy for supervising tool understanding. By incorporating meta-task data into task-oriented training, our method significantly enhances the performance of open-source LLMs, achieving results comparable to ChatGPT in both tool-based planning and chatting scenarios. Through large-scale instruction tuning, the MetaTool model demonstrates impressive zero-shot generalizability on new tasks.","Xiaohan Wang, Dian Li, Yilin Zhao, sinbadliu, Hui Wang","~Xiaohan_Wang3, ~Dian_Li1, ~Yilin_Zhao6, ~sinbadliu1, ~Hui_Wang23","large language models, tool learning, function calling, tool understanding, instruction tuning","foundation or frontier models, including LLMs",Submitted to ICLR 2025,2025,https://openreview.net/pdf?id=6AUzsrsNUx,https://openreview.net/forum?id=6AUzsrsNUx
