paper_id,title,abstract,authors,authorids,keywords,primary_area,venue,year,pdf_url,forum_url
rUH2EDpToF,Generative Marginalization Models,"We introduce *marginalization models* (MAMs), a new family of generative models
for high-dimensional discrete data. They offer scalable and flexible generative modeling with tractable likelihoods 
by explicitly modeling all induced marginal distributions. Marginalization models enable fast evaluation of arbitrary marginal probabilities with a single forward pass of the neural network, which overcomes a major limitation of methods with exact marginal inference, such as autoregressive models (ARMs). We propose scalable methods for learning the marginals, grounded in the concept of “*marginalization self-consistency*”. Unlike previous methods, MAMs support scalable training of any-order generative models for high-dimensional problems under the setting of *energy-based training*, where the goal is to match the learned distribution to a given desired probability (specified
by an unnormalized (log) probability function such as energy function or reward function). We demonstrate the effectiveness of the proposed model on a variety of discrete data distributions, including binary images, language, physical systems, and molecules, for *maximum likelihood* and *energy-based training* settings. MAMs achieve orders of magnitude speedup in evaluating the marginal probabilities on both settings. For energy-based training tasks, MAMs enable any-order generative modeling of high-dimensional problems beyond the capability of previous methods.","Sulin Liu, Peter Ramadge, Ryan P Adams","~Sulin_Liu1, ~Peter_Ramadge1, ~Ryan_P_Adams1","discrete generative models, marginalization, probabilistic models",generative models,Submitted to ICLR 2024,2024,https://openreview.net/pdf?id=rUH2EDpToF,https://openreview.net/forum?id=rUH2EDpToF
RIu5lyNXjT,Quantifying Language Models' Sensitivity to Spurious Features in Prompt Design or: How I learned to start worrying about prompt formatting,"As large language models (LLMs) are adopted as a fundamental component of language technologies, it is crucial to accurately characterize their performance. Because choices in prompt design can strongly influence model behavior, this design process is critical in effectively using any modern pre-trained generative language model. In this work, we focus on LLM sensitivity to a quintessential class of meaning-preserving design choices: prompt formatting. We find that several widely used open-source LLMs are extremely sensitive to subtle changes in prompt formatting in few-shot settings, with performance differences of up to 76 accuracy points when evaluated using LLaMA-2-13B. Sensitivity remains even when increasing model size, the number of few-shot examples, or performing instruction tuning. Our analysis suggests that work evaluating LLMs with prompting-based methods would benefit from reporting a range of performance across plausible prompt formats, instead of the currently-standard practice of reporting performance on a single format. We also show that format performance only weakly correlates between models, which puts into question the methodological validity of comparing models with an arbitrarily chosen, fixed prompt format. To facilitate systematic analysis we propose FormatSpread, an algorithm that rapidly evaluates a sampled set of plausible prompt formats for a given task, and reports the interval of expected performance without accessing model weights. Furthermore, we present a suite of analyses that characterize the nature of this sensitivity, including exploring the influence of particular atomic perturbations and the internal representation of particular formats.","Melanie Sclar, Yejin Choi, Yulia Tsvetkov, Alane Suhr","~Melanie_Sclar1, ~Yejin_Choi1, ~Yulia_Tsvetkov1, ~Alane_Suhr1","large language models, sensitivity analysis, prompt engineering, evaluation, prompting, robustness, in-context learning, spurious features",generative models,ICLR 2024 poster,2024,https://openreview.net/pdf?id=RIu5lyNXjT,https://openreview.net/forum?id=RIu5lyNXjT
iWi2mL8qoc,Multi-Scale Window based Transformer Network for High Quality Image Inpainting,"To achieve effective image inpainting, it is crucial for the model to understand contextual information. Previous studies using CNN-based algorithms have encountered limitations due to the absence of long-range dependencies, which resulted in the model's inability to capture contextual information. In this paper, we propose a Multi-Scale Window-based Transformer model for high-quality image inpainting. We introduce a transformer network with multi-scale windows to capture the influence of different window sizes and gather significant contextual information. To effectively integrate features processed through self-attention, we modified the polarized self-attention network to align with the dimensions of the multi-window scale. We also propose the Selective Mask Update method, which captures vital information from features processed by self-attention, enabling the generation of higher-quality results. Experiments show that it effectively fills in missing areas and demonstrates superior performance on the benchmark dataset compared to other models.","SeongJoo Kim, Jaeyoung Choi","~SeongJoo_Kim1, ~Jaeyoung_Choi2","Image inpainting, Image completion, Transformer, Multi-scale window, Polarized self-attention, Mask updating",generative models,Submitted to ICLR 2024,2024,https://openreview.net/pdf?id=iWi2mL8qoc,https://openreview.net/forum?id=iWi2mL8qoc
W478nWXfwO,What Makes Pre-Trained Visual Representations Successful for Robust Manipulation?,"Inspired by the success of transfer learning in computer vision, roboticists have investigated visual pre-training as a means to improve the learning efficiency and generalization ability of policies learned from pixels. To that end, past work has favored large object interaction datasets, such as first-person videos of humans completing diverse tasks, in pursuit of manipulation-relevant features. Although this approach improves the efficiency of policy learning, it remains unclear how reliable these representations are in the presence of distribution shifts that arise commonly in robotic applications. Surprisingly, we find that visual representations designed for manipulation and control tasks do not necessarily generalize under subtle changes in lighting and scene texture or the introduction of distractor objects. To understand what properties \textit{do} lead to robust representations, we compare the performance of 15 pre-trained vision models under different visual appearances. We find that emergent segmentation ability is a strong predictor of out-of-distribution generalization among ViT models. The rank order induced by this metric is more predictive than metrics that have previously guided generalization research within computer vision and machine learning, such as downstream ImageNet accuracy, in-domain accuracy, or shape-bias as evaluated by cue-conflict performance. We test this finding extensively on a suite of distribution shifts in ten tasks across two simulated manipulation environments. On the ALOHA setup, segmentation score predicts real-world performance after offline training with 50 demonstrations.","Kaylee Burns, Zach Witzel, Jubayer Ibn Hamid, Tianhe Yu, Chelsea Finn, Karol Hausman","~Kaylee_Burns2, ~Zach_Witzel1, ~Jubayer_Ibn_Hamid1, ~Tianhe_Yu1, ~Chelsea_Finn1, ~Karol_Hausman2","pre-trained visual representations, robot learning, robustness","representation learning for computer vision, audio, language, and other modalities",Submitted to ICLR 2024,2024,https://openreview.net/pdf?id=W478nWXfwO,https://openreview.net/forum?id=W478nWXfwO
V2cBKtdC3a,Exploring the Promise and Limits of Real-Time Recurrent Learning,"Real-time recurrent learning (RTRL) for sequence-processing recurrent neural networks (RNNs) offers certain conceptual advantages over backpropagation through time (BPTT). RTRL requires neither caching past activations nor truncating context, and enables online learning. However, RTRL's time and space complexity make it impractical. To overcome this problem, most recent work on RTRL focuses on approximation theories, while experiments are often limited to diagnostic settings. Here we explore the practical promise of RTRL in more realistic settings. We study actor-critic methods that combine RTRL and policy gradients, and test them in several subsets of DMLab-30, ProcGen, and Atari-2600 environments. On DMLab memory tasks, our system trained on fewer than 1.2B environmental frames is competitive with or outperforms well-known IMPALA and R2D2 baselines trained on 10B frames. To scale to such challenging tasks, we focus on certain well-known neural architectures with element-wise recurrence, allowing for tractable RTRL without approximation. Importantly, we also discuss rarely addressed limitations of RTRL in real-world applications, such as its complexity in the multi-layer case.","Kazuki Irie, Anand Gopalakrishnan, Jürgen Schmidhuber","~Kazuki_Irie1, ~Anand_Gopalakrishnan1, ~Jürgen_Schmidhuber1","recurrent neural networks, real-time recurrent learning, online recurrent learning, reinforcement learning, actor-critic, policy gradients","general machine learning (i.e., none of the above)",ICLR 2024 poster,2024,https://openreview.net/pdf?id=V2cBKtdC3a,https://openreview.net/forum?id=V2cBKtdC3a
b8hRudcKQ3,Performance Adjustment for Federated Learning Marketplace,"In federated learning, client participation is mainly motivated by performance-gain rewards or monetary rewards. In practice, different clients may have varying preferences over these two types of rewards. However, optimizing the training process to align model performance and monetary rewards with client expectations remains an open challenge. To accommodate diverse reward preferences, we propose Alpha-Tuning, an FL performance adjustment framework guided by dynamic validation loss composition. The core of our framework is a mechanism to decide the weights assigned to clients' local validation loss, each of which is determined by the corresponding client's performance contribution in the given training round and its monetary quotation for biasing this FL course towards its favor. The training hyper-parameters and model aggregation weights are adjusted together with model parameters to minimize the weighted sums of clients' local validation losses in our framework. Paired with a payment rule designed to compensate the clients according to their data contribution, Alpha-Tuning balances the clients' preferences between the performance gain and monetary reward. We demonstrate the effectiveness of our framework by conducting experiments on the federated learning tasks under various client quotation settings.","Liuyi Yao, Zitao Li, Weirui Kuang, Yaliang Li, Bolin Ding","~Liuyi_Yao1, ~Zitao_Li1, ~Weirui_Kuang2, ~Yaliang_Li1, ~Bolin_Ding3","Federated Learning, Incentive Mechanism","general machine learning (i.e., none of the above)",Submitted to ICLR 2024,2024,https://openreview.net/pdf?id=b8hRudcKQ3,https://openreview.net/forum?id=b8hRudcKQ3
gnWk0ZF22j,Customized Procedure Planning in Instructional Videos,"Generating customized procedures for task planning in instructional videos poses a unique challenge for vision-language models. In this paper, we introduce Customized Procedure Planning in Instructional Videos, a novel task that focuses on generating a sequence of detailed action steps for task completion based on user requirements and the task's initial visual state. Existing methods often neglect customization and user directions, limiting their real-world applicability. The absence of instructional video datasets with step-level state and video-specific action plan annotations has hindered progress in this domain. To address these challenges, we introduce the Customized Procedure Planner (CPP) framework, a causal, open-vocabulary model that leverages a LlaVA-based approach to predict procedural plans based on a task's initial visual state and user directions. To overcome the data limitation, we employ a weakly-supervised approach, using the strong vision-language model GEMINI and the large language model (LLM) GPT-4 to create detailed  video-specific action plans from the benchmark instructional video datasets (COIN, CrossTask), producing pseudo-labels for training. Discussing the limitations of the existing procedure planning evaluation metrics in an open-vocabulary setting, we propose novel automatic LLM-based metrics with few-shot in-context learning to evaluate the customization and planning capabilities of our model, setting a strong baseline. Additionally, we implement an LLM-based objective function to enhance model training for improved customization. Extensive experiments, including human evaluations, demonstrate the effectiveness of our approach, establishing a strong baseline for future research in customized procedure planning.","Ali Zare, Constantine Tsibouris, Xudong Lin, Li Zhang, Ming-Hsuan Yang, Shih-Fu Chang","~Ali_Zare1, ~Constantine_Tsibouris1, ~Xudong_Lin1, ~Li_Zhang1, ~Ming-Hsuan_Yang1, ~Shih-Fu_Chang3","Customized Procedure Planning, multi-modal models, vision-language models","applications to robotics, autonomy, planning",Submitted to ICLR 2025,2025,https://openreview.net/pdf?id=gnWk0ZF22j,https://openreview.net/forum?id=gnWk0ZF22j
gJG4IPwg6l,Safety Representations for Safer Policy Learning,"Reinforcement learning algorithms typically necessitate extensive exploration of the state space to find optimal policies. However, in safety-critical applications, the risks associated with such exploration can lead to catastrophic consequences. Existing safe exploration methods attempt to mitigate this by imposing constraints, which often result in overly conservative behaviours and inefficient learning. Heavy penalties for early constraint violations can trap agents in local optima, deterring exploration of risky yet high-reward regions of the state space. To address this, we introduce a method that explicitly learns state-conditioned safety representations. By augmenting the state features with these safety representations, our approach naturally encourages safer exploration without being excessively cautious, resulting in more efficient and safer policy learning in safety-critical scenarios. Empirical evaluations across diverse environments show that our method significantly improves task performance while reducing constraint violations during training, underscoring its effectiveness in balancing exploration with safety.","Kaustubh Mani, Vincent Mai, Charlie Gauthier, Annie S Chen, Samer B. Nashed, Liam Paull","~Kaustubh_Mani1, ~Vincent_Mai1, ~Charlie_Gauthier1, ~Annie_S_Chen1, ~Samer_B._Nashed1, ~Liam_Paull1","Reinforcement Learning, Safe Exploration, Representation Learning",reinforcement learning,ICLR 2025 Poster,2025,https://openreview.net/pdf?id=gJG4IPwg6l,https://openreview.net/forum?id=gJG4IPwg6l
RQ9fQLEajC,Routoo: Learning to Route to Large Language Models Effectively,"LLMs with superior response quality—particularly larger or closed-source models—often come with higher inference costs, making their deployment inefficient and costly. Meanwhile, developing foundational LLMs from scratch is becoming increasingly resource-intensive and impractical for many applications. To address the challenge of balancing quality and cost, we introduce Routoo, an architecture designed to optimize the selection of LLMs for specific prompts based on performance, cost, and efficiency. Routoo provides controllability over the trade-off between inference cost and quality, enabling significant reductions in inference costs for a given quality requirement.
Routoo comprises two key components: a performance predictor and cost-aware selector. The performance predictor is a lightweight LLM that estimates the expected performance of various underlying LLMs on a given prompt without executing them. The cost-aware selector module then selects the most suitable model based on these predictions and constraints such as cost and latency, significantly reducing inference costs for the same quality. 
We evaluated Routoo using the MMLU benchmark across 57 domains employing open-source models. Our results show that Routoo matches the performance of the Mixtral 8x7b model while reducing inference costs by one-third. Additionally, by allowing increased costs, Routoo surpasses Mixtral's accuracy by over 5\% at equivalent costs, achieving an accuracy of 75.9\%. When integrating GPT4 into our model pool, Routoo nearly matches GPT4's performance at half the cost and exceeds it with a 25\% cost reduction. 
These outcomes highlight Routoo's potential to significantly reduce inference costs without compromising quality, and even to establish new state-of-the-art results by leveraging the collective capabilities of multiple LLMs.","Alireza Mohammadshahi, Arshad Rafiq Shaikh, Majid Yazdani","~Alireza_Mohammadshahi1, ~Arshad_Rafiq_Shaikh1, ~Majid_Yazdani1","LLM, efficiency, knowledge integration, generation",generative models,Submitted to ICLR 2025,2025,https://openreview.net/pdf?id=RQ9fQLEajC,https://openreview.net/forum?id=RQ9fQLEajC
SDV7Y6Dhx9,Emphasizing Discriminative Features for Dataset Distillation in Complex Scenarios,"Dataset distillation has demonstrated strong performance on simple datasets like CIFAR, MNIST, and TinyImageNet but struggles to achieve similar results in more complex scenarios. 
In this paper, we propose a novel approach that \textbf{e}mphasizes the \textbf{d}iscriminative \textbf{f}eatures (obtained by Grad-CAM) for dataset distillation, called \textbf{EDF}.
Our approach is inspired by a key observation: in simple datasets, high-activation areas typically occupy most of the image, whereas in complex scenarios, the size of these areas is much smaller.
Unlike previous methods that treat all pixels equally when synthesizing images, EDF uses Grad-CAM activation maps to enhance high-activation areas.
From a supervision perspective, we downplay supervision signals that have lower losses, as they contain common patterns.
Additionally, to help the DD community better explore complex scenarios, we build the Complex Dataset Distillation (Comp-DD) benchmark by meticulously selecting sixteen subsets, eight easy and eight hard, from ImageNet-1K.
Notably, EDF consistently outperforms SOTA results in complex scenarios, such as ImageNet-1K subsets.
Hopefully, more researchers will be inspired and encouraged to enhance the practicality and efficacy of DD. 
Our code and benchmark will be made public.","Kai Wang, Zekai Li, Zhi-Qi Cheng, Samir Khaki, Ahmad Sajedi, Shanmukha Ramakrishna Vedantam, Konstantinos N Plataniotis, Alexander G Hauptmann, Yang You","~Kai_Wang8, ~Zekai_Li2, ~Zhi-Qi_Cheng1, ~Samir_Khaki1, ~Ahmad_Sajedi2, ~Shanmukha_Ramakrishna_Vedantam1, ~Konstantinos_N_Plataniotis1, ~Alexander_G_Hauptmann1, ~Yang_You1",dataset distillation,"applications to computer vision, audio, language, and other modalities",ICLR 2025 Conference Withdrawn Submission,2025,https://openreview.net/pdf?id=SDV7Y6Dhx9,https://openreview.net/forum?id=SDV7Y6Dhx9
7rq2OzkJg3,Personalized Federated Learning With Similarity Information Supervisor,"A crucial issue in federated learning is the heterogeneity of data between clients, which can lead to model weight divergence, eventually deteriorating the model performance. Personalized federated learning (pFL) has been proven to be an effective approach to addressing data heterogeneity in federated learning. However, existing pFL studies seldom verify whether the broadcast global model is beneficial for the local model performance. To address this, we propose a novel pFL method, called federated learning with similarity information supervision (FedSimSup). Specifically, FedSimSup incorporates a local supervisor to assist the model training and a personalized model for global information aggregation. The role of the supervisor is to refine the personalized model when it is not beneficial for the local model performance, ensuring the effective global information aggregation while aligning with the local heterogeneous data. Additionally, the similarity relationships between the clients are measured using label distribution differences of the local raw data to weight the personalized models, promoting information usage among similar clients. Experimental results demonstrate three advantages of FedSimSup: (1) It shows better performance over heterogeneous data compared with seven state-of-the-art federated learning methods; (2) It can allow for different model architectures across different clients; (3) It offers a certain degree of interpretability.","Jiaqiang Li, Qiqi Liu, Yaochu Jin, Xiaohu Wu, Zhilong Li, Han Yu","~Jiaqiang_Li1, ~Qiqi_Liu2, ~Yaochu_Jin1, ~Xiaohu_Wu2, ~Zhilong_Li3, ~Han_Yu1","Personalized Federated Learning, Heterogeneous Data","transfer learning, meta learning, and lifelong learning",Submitted to ICLR 2025,2025,https://openreview.net/pdf?id=7rq2OzkJg3,https://openreview.net/forum?id=7rq2OzkJg3
mqKVe6F3Up,Subtask-Aware Visual Reward Learning from Segmented Demonstrations,"Reinforcement Learning (RL) agents have demonstrated their potential across various robotic tasks. However, they still heavily rely on human-engineered reward functions, requiring extensive trial-and-error and access to target behavior information, often unavailable in real-world settings. This paper introduces REDS: REward learning from Demonstration with Segmentations, a novel reward learning framework that leverages action-free videos with minimal supervision. Specifically, REDS employs video demonstrations segmented into subtasks from diverse sources and treats these segments as ground-truth rewards. We train a dense reward function conditioned on video segments and their corresponding subtasks to ensure alignment with ground-truth reward signals by minimizing the Equivalent-Policy Invariant Comparison distance. Additionally, we employ contrastive learning objectives to align video representations with subtasks, ensuring precise subtask inference during online interactions. Our experiments show that REDS significantly outperforms baseline methods on complex robotic manipulation tasks in Meta-World and more challenging real-world tasks, such as furniture assembly in FurnitureBench, with minimal human intervention. Moreover, REDS facilitates generalization to unseen tasks and robot embodiments, highlighting its potential for scalable deployment in diverse environments.","Changyeon Kim, Minho Heo, Doohyun Lee, Honglak Lee, Jinwoo Shin, Joseph J Lim, Kimin Lee","~Changyeon_Kim1, ~Minho_Heo1, ~Doohyun_Lee2, ~Honglak_Lee2, ~Jinwoo_Shin1, ~Joseph_J_Lim1, ~Kimin_Lee1","Reinforcement Learning, Reward Learning, Robotic Manipulation","applications to robotics, autonomy, planning",ICLR 2025 Poster,2025,https://openreview.net/pdf?id=mqKVe6F3Up,https://openreview.net/forum?id=mqKVe6F3Up
OATPSB5JK1,Model-based Offline Reinforcement Learning with Lower Expectile Q-Learning,"Model-based offline reinforcement learning (RL) is a compelling approach that addresses the challenge of learning from limited, static data by generating imaginary trajectories using learned models. However, these approaches often struggle with inaccurate value estimation from model rollouts. In this paper, we introduce a novel model-based offline RL method, Lower Expectile Q-learning (LEQ), which provides a low-bias model-based value estimation via lower expectile regression of $\lambda$-returns. Our empirical results show that LEQ significantly outperforms previous model-based offline RL methods on long-horizon tasks, such as the D4RL AntMaze tasks, matching or surpassing the performance of model-free approaches and sequence modeling approaches. Furthermore, LEQ matches the performance of state-of-the-art model-based and model-free methods in dense-reward environments across both state-based tasks (NeoRL and D4RL) and pixel-based tasks (V-D4RL), showing that LEQ works robustly across diverse domains. Our ablation studies demonstrate that lower expectile regression, $\lambda$-returns, and critic training on offline data are all crucial for LEQ.","Kwanyoung Park, Youngwoon Lee","~Kwanyoung_Park1, ~Youngwoon_Lee1","model-based offline reinforcement learning, offline reinforcement learning, lower expectile return",reinforcement learning,ICLR 2025 Poster,2025,https://openreview.net/pdf?id=OATPSB5JK1,https://openreview.net/forum?id=OATPSB5JK1
