paper_id,title,abstract,authors,authorids,keywords,primary_area,venue,year,pdf_url,forum_url,author_ids,submission_date
VB2WkqvFwF,The Underlying Scaling Laws and Universal Statistical Structure of Complex Datasets,"We study universal traits which emerge both in real-world complex datasets, as well as in artificially generated ones. Our approach is to analogize data to a physical system and employ tools from statistical physics and Random Matrix Theory (RMT) to reveal their underlying structure. We focus on the feature-feature covariance matrix, analyzing both its local and global eigenvalue statistics. Our main observations are: (i) The power-law scalings that the bulk of its eigenvalues exhibit are vastly different for uncorrelated normally distributed data compared to real-world data, (ii) this scaling behavior can be completely modeled by generating gaussian data with long range correlations, (iii) both generated and real-world datasets lie in the same universality class from the RMT perspective, as chaotic rather than integrable systems, (iv) the expected RMT statistical behavior already manifests for empirical covariance matrices at dataset sizes significantly smaller than those conventionally used for real-world training, and can be related to the number of samples required to approximate the population power-law scaling behavior, (v) the Shannon entropy is correlated with local RMT structure and eigenvalues scaling, and substantially smaller in strongly correlated datasets compared to uncorrelated synthetic data, and requires fewer samples to reach the distribution entropy. These findings show that with sufficient sample size, the Gram matrix of natural image datasets can be well approximated by a Wishart random matrix with a simple covariance structure, opening the door to rigorous studies of neural network dynamics and generalization which rely on the data Gram matrix.","Noam Itzhak Levi, Yaron Oz","~Noam_Itzhak_Levi1, ~Yaron_Oz1","Random Matrix Theory, Data Structure, Universality, Random Feature Models, Empirical Data Estimation, Neural Scaling Laws","representation learning for computer vision, audio, language, and other modalities",Submitted to ICLR 2024,2024,https://openreview.net/pdf?id=VB2WkqvFwF,https://openreview.net/forum?id=VB2WkqvFwF,,
vNZ420zDte,DREAM: Decoupled Reinforcement Learning with Reward Measurement for Large Language Model Test-time Training,"This paper studies the problem of large language model (LLM) test-time training, which aims to enhance the reasoning ability of LLMs via unlabeled test data. Recent works usually utilize majority voting to infer the labels of samples to guide the reinforcement learning process, which could be inaccurate and biased with potential error accumulation. Towards this end, we propose a novel approach named Decoupled Reinforcement Learning with Reward Measurement (DREAM) for LLM test-time training. The core of our proposed DREAM is to decouple the reward estimation from reinforcement learning with enhanced calibration. In particular, our DREAM trains an LLM-based calibration model which takes both questions and answers as input, and outputs the calibration scores. To mitigate overconfident results, the judge model is trained by simulating on an independent reference dataset with positive and negative pairs. The reference-based calibration scores would be incorporated into voting-based reward estimation to reduce the potential biases, which enhance reliable test-time training. Extensive experiments on benchmark datasets validate the superiority of the proposed DREAM in comparison with competing baselines.",,,"Reinforcement Learning, Test-Time Training, Large Language Model",reinforcement learning,ICLR 2026 Conference Submission,2026,https://openreview.net/pdf?id=vNZ420zDte,https://openreview.net/forum?id=vNZ420zDte,,
vuvG5rNBra,Spurious Privacy Leakage in Neural Networks,"Neural networks are vulnerable to privacy attacks aimed at stealing sensitive data. When trained on real-world datasets, these models can also inherit latent biases, which may further increase privacy risks. In this work, we investigate the impact of spurious correlation bias on privacy vulnerability, identifying several key challenges. We introduce _spurious privacy leakage_, a phenomenon where spurious groups can be up to 100 times more vulnerable to privacy attacks than non-spurious groups, and demonstrate how this leakage is connected to task complexity. Furthermore, while robust training methods can mitigate the performance disparity across groups, they fail to reduce privacy vulnerability, and even differential privacy is ineffective in protecting the most vulnerable spurious group in practice. Finally, we compare model architectures in terms of both performance and privacy, revisiting prior research with novel insights.","Chenxiang Zhang, Jun Pang, Sjouke Mauw","~Chenxiang_Zhang1, ~Jun_Pang1, ~Sjouke_Mauw1","spurious correlation, membership inference, privacy, robustness, safety","alignment, fairness, safety, privacy, and societal considerations",Submitted to ICLR 2025,2025,https://openreview.net/pdf?id=vuvG5rNBra,https://openreview.net/forum?id=vuvG5rNBra,,
vvD4ilobth,TCL-VS: Temporal Contrastive Learning for Self-Supervised Video Summarization,"The goal of video summarization is to extract the most important parts from the original video. 
Most existing methods are based on supervised learning and they have demonstrated superior performance. 
However, the scarcity of annotated data is a major obstacle in the video summarization task. 
To reduce the impact of the scarcity, some weakly-supervised and unsupervised methods were proposed. 
Although they manifested positive results, existing methods ignore the intrinsic association between video clips. 
To address it, we introduce a new self-supervised learning method called TCL-VS. Our main insight is that 
a excellent summary requires not only maintaining the original video content but also eliminating redundant information.
Inspired by the observation, this work consists of two separate modules that respectively conduct 
temporal consistency and diversity assessment of video clips. Each module predicts a sequence score by clip, 
and then we combine them using a weighted method. Extensive experiments demonstrate that 
our method achieves state-of-the-art performance on two video summarization benchmarks: SumMe and TVSum.","Jiajun Han, Xuran Yang, kun shen Xu, Hui Zhang, Kanle Shi","~Jiajun_Han1, ~Xuran_Yang1, ~kun_shen_Xu1, ~Hui_Zhang1, ~Kanle_Shi1","Video Summarization, Self-Supervised, Contrastive Learning","representation learning for computer vision, audio, language, and other modalities",ICLR 2024 Conference Withdrawn Submission,2024,https://openreview.net/pdf?id=vvD4ilobth,https://openreview.net/forum?id=vvD4ilobth,,
WMInu1V9av,AURA: Visually Interpretable Affective Understanding via Robust Archetypes,"Text-driven vision--language methods (e.g., CLIP variants) face three persistent hurdles in affective computing: (i) limited support for continuous regression (e.g., Valence--Arousal), (ii) brittle reliance on language prompts, and (iii) the absence of a unified paradigm across expression classification, action-unit detection, and affective regression. We introduce AURA, a prompt-free framework that operates directly in a frozen CLIP visual space via visual archetypes. AURA comprises two components: (1) self-organized archetype discovery, which adaptively allocates the number of archetypes per affective state, assigning denser archetype sets to complex or ambiguous states for fine-grained interpretability, and (2) archetype contextualization, which models interactions among the most relevant archetypes and semantic tokens to enhance structural consistency while suppressing redundancy. Inference reduces to cosine matching between projected features and fixed archetypes. Across six datasets, AURA consistently surpasses prior state-of-the-art while remaining highly efficient. Overall, AURA unifies classification, detection, and regression under a single visual-archetype paradigm, delivering strong accuracy, cognitively aligned interpretability, and excellent training/inference efficiency.",,,"valence-arousal, facial expressions, action units","applications to computer vision, audio, language, and other modalities",ICLR 2026 Conference Submission,2026,https://openreview.net/pdf?id=WMInu1V9av,https://openreview.net/forum?id=WMInu1V9av,,
X9JU2gKEkR,Arctic-SnowCoder: Demystifying High-Quality Data in Code Pretraining,"Recent studies have been increasingly demonstrating that high-quality data is crucial for effective pretraining of language models. However, the precise definition of ""high-quality"" remains underexplored. Focusing on the code domain, we introduce Arctic-SnowCoder-1.3B, a data-efficient base code model pretrained on 555B tokens through three phases of progressively refined data: (1) general pretraining with 500B standard-quality code tokens, preprocessed through basic filtering, deduplication, and decontamination, (2) continued pretraining with 50B high-quality tokens, selected from phase one by a BERT-style quality annotator trained to distinguish good code from random data, using positive examples drawn from high-quality code files, along with instruction data from Magicoder and StarCoder2-Instruct, and (3) enhanced pretraining with 5B synthetic data created by Llama-3.1-70B using phase two data as seeds, adapting the Magicoder approach for pretraining. Despite being trained on a limited dataset, Arctic-SnowCoder achieves state-of-the-art performance on BigCodeBench, a coding benchmark focusing on practical and challenging programming tasks, compared to similarly sized models trained on no more than 1T tokens, outperforming Phi-1.5-1.3B by 36%. Across all evaluated benchmarks, Arctic-SnowCoder-1.3B beats StarCoderBase-3B pretrained on 1T tokens. Additionally, it matches the performance of leading small base code models trained on trillions of tokens. For example, Arctic-SnowCoder-1.3B surpasses StarCoder2-3B, pretrained on over 3.3T tokens, on HumanEval+, a benchmark that evaluates function-level code generation, and remains competitive on BigCodeBench. Our evaluation presents a comprehensive analysis justifying various design choices for Arctic-SnowCoder. Most importantly, we find that the key to high-quality data is its consistency with the distribution of downstream applications.","Yuxiang Wei, Hojae Han, Rajhans Samdani","~Yuxiang_Wei2, ~Hojae_Han1, ~Rajhans_Samdani1","Large language models, Code generation, Pretraining, Data quality","foundation or frontier models, including LLMs",Submitted to ICLR 2025,2025,https://openreview.net/pdf?id=X9JU2gKEkR,https://openreview.net/forum?id=X9JU2gKEkR,,
xrwPLtSCM3,ProxyFL: A Proxy-Guided Framework for Federated Semi-Supervised Learning,"Federated Semi-Supervised Learning (FSSL) aims to collaboratively train a global model by leveraging unlabeled data and limited labeled data across clients in a privacy-preserving manner. In FSSL, data heterogeneity is a challenging issue, which exists both across clients (external heterogeneity) and within clients (internal heterogeneity). Most FSSL methods typically design fixed or dynamic weight aggregation strategy on the server (for external) or filter out low-confidence unlabeled samples directly by an empirical threshold to reduce mistakes in local client (for internal). But, the former is hard to precisely fit the real global category distribution due to external heterogeneity, and the latter results in fewer training participation of available samples in FL. To address these issues, we propose a proxy-guided framework called ProxyFL that focuses on simultaneously mitigating external and internal heterogeneity via a unified proxy. \emph{I.e.}, we consider the learnable weights of classifier as proxy to simulate the category distribution both locally and globally. For external, we explicitly optimize global proxy to better fit the category distribution across clients; for internal, we include the discarded samples together with other samples into training based upon a positive-negative proxy pool {without compromising wrong pseudo-labels.} Insight experiments \& theoretical analysis show that ProxyFL significantly boost the FSSL performance and convergence.",,,Federated Semi-Supervised Learning; Federated Learning,"other topics in machine learning (i.e., none of the above)",ICLR 2026 Conference Submission,2026,https://openreview.net/pdf?id=xrwPLtSCM3,https://openreview.net/forum?id=xrwPLtSCM3,,
Xy1Lf7uR9H,ANOVA-NODE: An identifiable neural network for the functional ANOVA model for better interpretability,"Interpretability for machine learning models is becoming more and more important as machine learning models become more complex. 
The functional ANOVA model, which decomposes a high-dimensional function into a sum of lower dimensional functions so called components, is one of the most popular tools for interpretable AI, and recently, various neural network models have been developed for estimating each component in the functional ANOVA model. 
However, such neural networks are highly unstable when estimating components since the components themselves are not uniquely defined. 
That is, there are multiple functional ANOVA decompositions for a given function. 
In this paper, we propose a novel interpretable model which guarantees a unique functional ANOVA decomposition and thus is able to estimate each component stably. 
We call our proposed model ANOVA-NODE since it is a modification of Neural Oblivious Decision Ensembles (NODE) for the functional ANOVA model. 
Theoretically, we prove that ANOVA-NODE can approximate a smooth function well.
Additionally, we experimentally show that ANOVA-NODE provides much more stable estimation of each component and thus much more stable interpretation when training data and initial values of the model parameters vary than existing neural network models do.","Seokhun Park, Insung Kong, yongchan Choi, Chanmoo Park, Yongdai Kim","~Seokhun_Park1, ~Insung_Kong1, ~yongchan_Choi1, ~Chanmoo_Park1, ~Yongdai_Kim1","Interpretability, Explianability, Trustworthy AI, Functional ANOVA model, Generalized additive models",interpretability and explainable AI,Submitted to ICLR 2025,2025,https://openreview.net/pdf?id=Xy1Lf7uR9H,https://openreview.net/forum?id=Xy1Lf7uR9H,,
Y4UliyX3LE,Learning Dispersed Embeddings on Hyperspheres,"Learning well-separated features in high-dimensional spaces, such as text or image $\textit{embeddings}$, is crucial for many machine learning applications. Achieving such separation can be effectively accomplished through the $\textit{dispersion}$ of embeddings, where unrelated vectors are pushed apart as much as possible. By constraining features to be on a $\textit{hypersphere}$, we can connect dispersion to well-studied problems in mathematics and physics, where optimal solutions are known for limited low-dimensional cases. However, in representation learning we typically deal with a large number of features in high-dimensional space, which makes leveraging existing theoretical and numerical solutions impossible. Therefore, we rely on gradient-based methods to approximate the optimal dispersion on a hypersphere. In this work, we first give an overview of existing methods from disconnected literature. Next, we propose new reinterpretations of known methods, namely Maximum Mean Discrepancy (MMD) and Lloyd’s relaxation algorithm. Finally, we derive a novel dispersion method that directly exploits properties of the hypersphere. Our experiments show the importance of dispersion in image classification and natural language processing tasks, and how algorithms exhibit different trade-offs in different regimes.","Evgeniia Tokarchuk, Hua Chang Bakker, Vlad Niculae","~Evgeniia_Tokarchuk1, ~Hua_Chang_Bakker1, ~Vlad_Niculae2","embeddings, dispersion, hypersphere, representation learning, separation","unsupervised, self-supervised, semi-supervised, and supervised representation learning",Submitted to ICLR 2025,2025,https://openreview.net/pdf?id=Y4UliyX3LE,https://openreview.net/forum?id=Y4UliyX3LE,,
ye3NrNrYOY,Temporal Causal Mechanism Transfer for Few-shot Action Recognition,"The goal of few-shot action recognition is to recognize actions in video sequences for which there exists only a few training samples. The challenge is to adapt a base model effectively and efficiently when the base and novel data have significant distributional disparities. To this end, we learn a model of a temporal causal mechanism from the base data by variational inference. When adapting the model by training on the novel data set we hold certain aspects of the causal mechanism fixed, updating only auxiliary variables and a classifier. During this adapation phase, we treat as invariant the time-delayed causal relations between latent causal variables and the mixing function that maps causal variables to action representations. Our experimental evaluations across standard action recognition datasets validate our hypothesis that our proposed method of Temporal Causal Mechanism Transfer (TCMT) enables efficient few-shot action recognition in video sequences with notable performance improvements over leading benchmarks.","Yuke Li, Guangyi Chen, Ben Abramowitz, Stefano Anzellotti, Donglai Wei","~Yuke_Li1, ~Guangyi_Chen1, ~Ben_Abramowitz1, ~Stefano_Anzellotti1, ~Donglai_Wei1","few-shot action recognition, causal representation learning","representation learning for computer vision, audio, language, and other modalities",Submitted to ICLR 2024,2024,https://openreview.net/pdf?id=ye3NrNrYOY,https://openreview.net/forum?id=ye3NrNrYOY,,
YlDHsGqjCO,Perishable Online Inventory Control with Context-Aware Demand Distributions,"We study the online contextual inventory control problem with perishable goods. In this work, we propose and consider a more realistic---and more challenging---setting where both the expected demand and the (residual) noise distribution depend on the observable features. Surprisingly, little is known when the noise is context-dependent, which captures the heteroskedastic uncertainty in demand that is important in inventory control. The optimal inventory quantity in this general setting is no longer a linear function of features (unlike the case when the expected demand is linear and the noise is i.i.d.), making online gradient descent---the gold standard therein---inapplicable. We first propose an algorithm that achieves the near-optimal regret $\widetilde{O}(\sqrt{d T}+T^{\frac{p+1}{p+2}})$ under linear expected demand and context-aware noise. Here $d$ is the feature dimension, and $p \leq d$ is an underlying dimension that captures the intrinsic complexity of the noise distribution. When the expected demand is nonlinear, we propose to use neural networks to capture the nonlinearity, and prove a regret bound $\widetilde{O}(\sqrt{\alpha T}+T^{\frac{p+1}{p+2}})$ under over-parameterized networks, where $\alpha$ depends on the nonlinear demand complexity and the network architecture. Additionally, under mild regularity conditions on the noise, the exponential factor $T^{\frac{p+1}{p+2}}$ in these regret bounds is improved to $p\sqrt{T}$. Finally, we provide a matching minimax lower bound $\Omega(\sqrt{d T}+T^{\frac{p+1}{p+2}})$ under linear expected demand. To our best knowledge, our results provide the first minimax optimal characterization for online inventory control with context-dependent noise and the first theoretical guarantees when the expected demand is nonlinear in features.",,,"online learning, inventory control, kernel regression, contextual bandits, neural bandits",learning theory,ICLR 2026 Conference Submission,2026,https://openreview.net/pdf?id=YlDHsGqjCO,https://openreview.net/forum?id=YlDHsGqjCO,,
yrPiUpkXQh,Probabilistic Modeling of Multi-rater Medical Image Segmentation for Diversity and Personalization,"Medical image segmentation is inherently influenced by data uncertainty, arising from ambiguous boundaries in medical scans and subjective variations among expert annotators. To address this challenge, previous works formulated the multi-rater medical image segmentation task, where multiple experts provide separate annotations for each image. However, existing models are typically constrained to either generating diverse segmentations that lack expert specificity or producing personalized outputs that merely replicate individual annotators. We propose Probabilistic modeling of multi-rater medical image Segmentation (ProSeg) that simultaneously enables both diversification and personalization. Extensive experiments on both the nasopharyngeal carcinoma dataset (NPC) and the lung nodule dataset (LIDC-IDRI) demonstrate that our ProSeg achieves a new state-of-the-art performance, providing segmentation results that are both diverse and expert-personalized.",,,probabilistic modeling,"applications to computer vision, audio, language, and other modalities",ICLR 2026 Conference Submission,2026,https://openreview.net/pdf?id=yrPiUpkXQh,https://openreview.net/forum?id=yrPiUpkXQh,,
zfAcPuIHkE,Logic Channel Validation and Enhancement of Zero-Shot Vision-Language Comprehension on Vision Language Models,"Frontier Large Vision-Language Models (LVLMs) exhibit remarkable capabilities in Visual-Language Comprehension (VLC) tasks, enabled by pretraining on vast visual-textual corpus. However, they are often deployed as zero-shot solution in a black-box manner, as retraining challenges remain due to data privacy or model inaccessibility. Validating and understanding the behavior of the models become important for generalization to new task. We propose a Logic Channel, in parallel with the black-box model channel, to perform explicit logic reasoning for validation and enhancement. The frontier LVLM, encapsulating latent vision-language knowledge, can be considered as an Implicit Logic Channel. The proposed Explicit Logic Channel, mimicking human logic reasoning, incorporates a Large Language Model (LLM), a Visual Foundation Model (VFM), and a logical reasoning module involving novel probabilistic inference for factual, counterfactual, relational, and causal condition reasoning over the extracted and grounded visual-textual facts. Cross-channel logic consistency analysis enables model validation and selection, even without ground-truth annotations. Additionally, cross-channel integration further improves performance in zero-shot tasks over SOTA models. Our experiments on three recent challenging VLC benchmarks, Neg- Bench, HC-RefCOCOg, and HC-RefLoCo, demonstrate the effectiveness of the proposed Logic Channel for logic-based model validation, selection and improvement on LVLM with enhanced explainability and trustworthiness.",,,"Vision-Language Model, Visual-Language Comprehension, logic reasoning, zero-shot",interpretability and explainable AI,ICLR 2026 Conference Submission,2026,https://openreview.net/pdf?id=zfAcPuIHkE,https://openreview.net/forum?id=zfAcPuIHkE,,
ZhXJNUEOr9,Sparling: Learning Latent Representations with Extremely Sparse Activations,"Real-world processes often contain intermediate state that can be modeled as an extremely sparse activation tensor. In this work, we analyze the identifiability of such sparse and local latent intermediate variables, which we call motifs.
We prove our Motif Identifiability Theorem, stating that under certain assumptions it is possible to precisely identify these motifs exclusively by reducing end-to-end error. Additionally, we provide the Sparling algorithm, which uses a new kind of informational bottleneck that enforces levels of activation sparsity unachievable using other techniques. We find that extreme sparsity is necessary to achieve good intermediate state modeling empirically. On our synthetic DigitCircle domain as well as the LaTeXOCR and AudioMNISTSequence domains, we are able to precisely localize the intermediate states up to feature permutation with >90% accuracy, even though we only train end-to-end.","Kavi Gupta, Osbert Bastani, Armando Solar-Lezama","~Kavi_Gupta1, ~Osbert_Bastani1, ~Armando_Solar-Lezama1","machine learning, sparsity, interpretability, optimization, identifiability",interpretability and explainable AI,Submitted to ICLR 2025,2025,https://openreview.net/pdf?id=ZhXJNUEOr9,https://openreview.net/forum?id=ZhXJNUEOr9,,
ZmhpqpKzAT,IGC-Net for conditional average potential outcome estimation over time,"Estimating potential outcomes for treatments over time based on observational data is important for personalized decision-making in medicine. However, many existing methods for this task fail to properly adjust for time-varying confounding and thus yield biased estimates. There are only a few neural methods with proper adjustments, but these have inherent limitations (e.g., division by propensity scores that are often close to zero), which result in poor performance. As a remedy, we introduce the iterative G-computation network (IGC-Net). Our IGC-Net is a novel, neural end-to-end model which adjusts for time-varying confounding in order to estimate conditional average potential outcomes (CAPOs) over time. Specifically, our IGC-Net is the first neural model to perform fully regression-based iterative G-computation for CAPOs in the time-varying setting. We evaluate the effectiveness of our IGC-Net across various experiments. In sum, this work represents a significant step towards personalized decision-making from electronic health records.",,,"causal inference, potential outcomes, treatment effects, healthcare",causal reasoning,ICLR 2026 Conference Submission,2026,https://openreview.net/pdf?id=ZmhpqpKzAT,https://openreview.net/forum?id=ZmhpqpKzAT,,
